{
  "format_version": "1",
  "rules": {
    "account-lookup": "generic/scope",
    "account-management": "generic/scope",
    "application-lookup": "generic/entity",
    "application-settings": "generic/entity",
    "aws-connection": "generic/network",
    "browser-application": "generic/entity",
    "cardinality-management": "generic/entity",
    "cloud-account-lookup": "generic/entity",
    "cloud-aws-eu-sovereign-integrations": "generic/entity",
    "cloud-aws-eu-sovereign-link-account": "generic/entity",
    "cloud-aws-govcloud-integrations": "generic/entity",
    "cloud-aws-govcloud-link-account": "generic/entity",
    "cloud-aws-integrations": "generic/entity",
    "cloud-aws-link-account": "generic/entity",
    "cloud-azure-integrations": "generic/entity",
    "cloud-azure-link-account": "generic/entity",
    "cloud-gcp-dm-integrations": "generic/entity",
    "cloud-gcp-integrations": "generic/entity",
    "cloud-gcp-link-account": "generic/entity",
    "cloud-oci-link-account": "generic/entity",
    "data-partition-rule": "generic/entity",
    "events-to-metrics-rule": "generic/entity",
    "federated-logs-partition": "generic/storage",
    "federated-logs-setup": "generic/storage",
    "fleet": "generic/compute",
    "fleet-configuration": "generic/entity",
    "fleet-configuration-lookup": "generic/entity",
    "fleet-deployment": "generic/entity",
    "fleet-members": "generic/entity",
    "fleet-members-lookup": "generic/entity",
    "key-transaction": "generic/entity",
    "key-transaction-lookup": "generic/entity",
    "log-parsing-rule": "generic/entity",
    "metric-pruning-rule": "generic/entity",
    "nrql-drop-rule": "generic/entity",
    "obfuscation-expression": "generic/entity",
    "obfuscation-expression-lookup": "generic/entity",
    "obfuscation-rule": "generic/entity",
    "pipeline-cloud-rule": "generic/entity",
    "synthetics-broken-links-monitor": "generic/entity",
    "synthetics-cert-check-monitor": "generic/entity",
    "synthetics-monitor": "generic/entity",
    "synthetics-private-location": "generic/compute",
    "synthetics-private-location-lookup": "generic/compute",
    "synthetics-script-monitor": "generic/entity",
    "synthetics-step-monitor": "generic/entity",
    "workload": "generic/scope"
  },
  "rule_labels": {
    "account-lookup": "New Relic account lookup",
    "account-management": "New Relic account",
    "application-lookup": "New Relic APM application lookup",
    "application-settings": "New Relic application settings",
    "aws-connection": "New Relic AWS Connection",
    "browser-application": "New Relic browser application",
    "cardinality-management": "New Relic cardinality management",
    "cloud-account-lookup": "New Relic linked cloud account lookup",
    "cloud-aws-eu-sovereign-integrations": "New Relic AWS European Union Sovereign Cloud integrations",
    "cloud-aws-eu-sovereign-link-account": "New Relic AWS European Union Sovereign Cloud linked account",
    "cloud-aws-govcloud-integrations": "New Relic AWS GovCloud integrations",
    "cloud-aws-govcloud-link-account": "New Relic AWS GovCloud linked account",
    "cloud-aws-integrations": "New Relic AWS integrations",
    "cloud-aws-link-account": "New Relic AWS linked account",
    "cloud-azure-integrations": "New Relic Azure integrations",
    "cloud-azure-link-account": "New Relic Azure linked account",
    "cloud-gcp-dm-integrations": "New Relic Google Cloud dimensional metrics integrations",
    "cloud-gcp-integrations": "New Relic Google Cloud integrations",
    "cloud-gcp-link-account": "New Relic Google Cloud linked account",
    "cloud-oci-link-account": "New Relic Oracle Cloud Infrastructure linked account",
    "data-partition-rule": "New Relic data partition rule",
    "events-to-metrics-rule": "New Relic events-to-metrics rule",
    "federated-logs-partition": "New Relic Federated Logs partition",
    "federated-logs-setup": "New Relic Federated Logs setup",
    "fleet": "New Relic Fleet Control fleet",
    "fleet-configuration": "New Relic Fleet Control configuration",
    "fleet-configuration-lookup": "New Relic Fleet Control configuration lookup",
    "fleet-deployment": "New Relic Fleet Control deployment",
    "fleet-members": "New Relic Fleet Control membership",
    "fleet-members-lookup": "New Relic Fleet Control membership lookup",
    "key-transaction": "New Relic key transaction",
    "key-transaction-lookup": "New Relic key transaction lookup",
    "log-parsing-rule": "New Relic log parsing rule",
    "metric-pruning-rule": "New Relic metric pruning rule",
    "nrql-drop-rule": "New Relic NRQL drop rule",
    "obfuscation-expression": "New Relic obfuscation expression",
    "obfuscation-expression-lookup": "New Relic obfuscation expression lookup",
    "obfuscation-rule": "New Relic obfuscation rule",
    "pipeline-cloud-rule": "New Relic Pipeline Cloud Rule",
    "synthetics-broken-links-monitor": "New Relic Synthetics broken links monitor",
    "synthetics-cert-check-monitor": "New Relic Synthetics certificate check monitor",
    "synthetics-monitor": "New Relic Synthetics monitor",
    "synthetics-private-location": "New Relic Synthetics private location",
    "synthetics-private-location-lookup": "New Relic Synthetics private location lookup",
    "synthetics-script-monitor": "New Relic Synthetics scripted monitor",
    "synthetics-step-monitor": "New Relic Synthetics step monitor",
    "workload": "New Relic workload"
  },
  "concepts": {
    "apm-application": "generic/entity",
    "application-configuration": "generic/entity",
    "aws-connection": "generic/network",
    "cloud-integration-configuration": "generic/entity",
    "federated-logs-partition": "generic/storage",
    "federated-logs-setup": "generic/storage",
    "fleet": "generic/compute",
    "fleet-configuration": "generic/entity",
    "fleet-deployment": "generic/entity",
    "fleet-membership": "generic/entity",
    "observability-tenant": "generic/scope",
    "observability-workload": "generic/scope",
    "telemetry-processing-configuration": "generic/entity"
  },
  "concept_labels": {
    "apm-application": "New Relic APM application",
    "application-configuration": "New Relic application configuration",
    "aws-connection": "New Relic AWS Connection",
    "cloud-integration-configuration": "New Relic cloud integration configuration",
    "federated-logs-partition": "New Relic Federated Logs partition",
    "federated-logs-setup": "New Relic Federated Logs setup",
    "fleet": "New Relic Fleet Control fleet",
    "fleet-configuration": "New Relic Fleet Control configuration",
    "fleet-deployment": "New Relic Fleet Control deployment",
    "fleet-membership": "New Relic Fleet Control membership",
    "observability-workload": "New Relic workload",
    "telemetry-processing-configuration": "New Relic telemetry processing configuration"
  },
  "resources": {
    "resource/newrelic_workflow_automation": "generic/entity",
    "resource/newrelic_service_level": "generic/entity"
  },
  "resource_labels": {
    "resource/newrelic_workflow_automation": "New Relic Workflow Automation workflow",
    "resource/newrelic_service_level": "New Relic service level"
  }
}
